{
  "$schema": "https://json-schema.org/draft/2020-12/schema",
  "title": "Trellis theme v1",
  "type": "object",
  "additionalProperties": false,
  "required": [
    "version",
    "id",
    "name",
    "appearance"
  ],
  "properties": {
    "version": {
      "const": 1
    },
    "id": {
      "type": "string",
      "pattern": "^[a-z][a-z0-9-]{0,63}$"
    },
    "name": {
      "type": "string",
      "minLength": 1,
      "maxLength": 100
    },
    "appearance": {
      "enum": [
        "dark",
        "light"
      ]
    },
    "terminal": {
      "type": "object",
      "additionalProperties": false,
      "properties": {
        "background": {
          "type": "string",
          "pattern": "^#[0-9A-Fa-f]{6}$"
        },
        "foreground": {
          "type": "string",
          "pattern": "^#[0-9A-Fa-f]{6}$"
        },
        "cursor": {
          "type": "string",
          "pattern": "^#[0-9A-Fa-f]{6}$"
        },
        "cursorText": {
          "type": "string",
          "pattern": "^#[0-9A-Fa-f]{6}$"
        },
        "selectionBackground": {
          "type": "string",
          "pattern": "^#[0-9A-Fa-f]{6}$"
        },
        "selectionForeground": {
          "type": "string",
          "pattern": "^#[0-9A-Fa-f]{6}$"
        },
        "ansi": {
          "type": "array",
          "minItems": 16,
          "maxItems": 16,
          "items": {
            "type": "string",
            "pattern": "^#[0-9A-Fa-f]{6}$"
          }
        }
      }
    },
    "ui": {
      "type": "object",
      "additionalProperties": false,
      "properties": {
        "background": {
          "type": "string",
          "pattern": "^#[0-9A-Fa-f]{6}$"
        },
        "surface": {
          "type": "string",
          "pattern": "^#[0-9A-Fa-f]{6}$"
        },
        "sidebarBackground": {
          "type": "string",
          "pattern": "^#[0-9A-Fa-f]{6}$"
        },
        "foreground": {
          "type": "string",
          "pattern": "^#[0-9A-Fa-f]{6}$"
        },
        "mutedForeground": {
          "type": "string",
          "pattern": "^#[0-9A-Fa-f]{6}$"
        },
        "accent": {
          "type": "string",
          "pattern": "^#[0-9A-Fa-f]{6}$"
        },
        "border": {
          "type": "string",
          "pattern": "^#[0-9A-Fa-f]{6}$"
        },
        "activeTabBackground": {
          "type": "string",
          "pattern": "^#[0-9A-Fa-f]{6}$"
        },
        "activeTabForeground": {
          "type": "string",
          "pattern": "^#[0-9A-Fa-f]{6}$"
        },
        "focusRing": {
          "type": "string",
          "pattern": "^#[0-9A-Fa-f]{6}$"
        },
        "success": {
          "type": "string",
          "pattern": "^#[0-9A-Fa-f]{6}$"
        },
        "warning": {
          "type": "string",
          "pattern": "^#[0-9A-Fa-f]{6}$"
        },
        "error": {
          "type": "string",
          "pattern": "^#[0-9A-Fa-f]{6}$"
        }
      }
    }
  }
}
