{
  "version": 1,
  "id": "trellis-one-light",
  "name": "One Light",
  "appearance": "light",
  "terminal": {
    "background": "#FAFAFA",
    "foreground": "#383A42",
    "cursor": "#325DBD",
    "cursorText": "#FAFAFA",
    "selectionBackground": "#D8E2F5",
    "selectionForeground": "#383A42",
    "ansi": [
      "#EAEAEB",
      "#B52A42",
      "#42782A",
      "#896000",
      "#285ECC",
      "#8B3FA4",
      "#007F8B",
      "#383A42",
      "#7C7D82",
      "#9A2438",
      "#386624",
      "#745200",
      "#2250AD",
      "#76368B",
      "#006C76",
      "#383A42"
    ]
  },
  "ui": {
    "background": "#FAFAFA",
    "surface": "#F5F5F7",
    "sidebarBackground": "#EEEFF2",
    "foreground": "#383A42",
    "mutedForeground": "#606267",
    "accent": "#325DBD",
    "border": "#D8DAE0",
    "activeTabBackground": "#E7ECF7",
    "activeTabForeground": "#383A42",
    "focusRing": "#325DBD",
    "success": "#3D6E27",
    "warning": "#896000",
    "error": "#B52A42"
  }
}
